{
  "code": "too-good-price",
  "role": "buyer",
  "title": "Слишком выгодная цена",
  "description": "Смартфон продают вдвое дешевле рынка. Продавец торопит с бронью и предлагает перевести задаток напрямую.",
  "intro": "Вы покупатель. Нашли нужную модель заметно дешевле, чем у остальных, и написали продавцу. Впереди три решения — каждое меняет ход разговора.",
  "difficulty": "demo",
  "estimated_minutes": 2,
  "start_step": "s1",
  "steps": [
    {
      "code": "s1",
      "type": "dialog",
      "content": {
        "sender": "counterparty",
        "message": "Здравствуйте! Да, телефон в наличии, состояние идеальное. Цена такая, потому что срочно нужны деньги — улетаю завтра. Берёте?",
        "context": "Такая же модель в других объявлениях стоит в два раза дороже."
      },
      "risk_signals": [
        "RISK_TOO_GOOD_PRICE",
        "RISK_URGENCY_PRESSURE"
      ],
      "options": [
        {
          "code": "a",
          "text": "Согласиться сразу, пока телефон не купили",
          "outcome": "critical",
          "score": -10,
          "feedback": "Цена вдвое ниже рынка и срочный отъезд — это связка приманки и давления. Решение принимается до проверки товара, а именно на это схема и рассчитана. Спокойный вопрос о состоянии и готовность к безопасной сделке ничего не стоят и сразу показывают, настоящий ли продавец.",
          "next_step": "s2"
        },
        {
          "code": "b",
          "text": "Спросить, почему так дёшево",
          "outcome": "risky",
          "score": 0,
          "feedback": "Вы ничего не потеряли, но и не проверили ничего: у мошенника всегда готово объяснение — переезд, срочность, подарок оказался ненужным. Причина низкой цены не проверяема, а вот способ оплаты проверяем сразу.",
          "next_step": "s2"
        },
        {
          "code": "c",
          "text": "Предложить оформить покупку с доставкой через платформу",
          "outcome": "safe",
          "score": 10,
          "feedback": "Разговор сразу переходит к проверяемому: при доставке платформы деньги придут продавцу только после получения товара. Добросовестного продавца это устраивает, и низкая цена перестаёт быть риском.",
          "next_step": "s3"
        }
      ]
    },
    {
      "code": "s2",
      "type": "dialog",
      "content": {
        "sender": "counterparty",
        "message": "Через доставку долго, а я уезжаю. Давайте так: переведите 3000 ₽ задатка на карту, я сниму объявление и придержу телефон до вечера.",
        "context": "Продавец прислал номер карты на чужое имя."
      },
      "risk_signals": [
        "RISK_PREPAY_OUTSIDE",
        "RISK_URGENCY_PRESSURE"
      ],
      "options": [
        {
          "code": "a",
          "text": "Перевести задаток, чтобы телефон не ушёл другому",
          "outcome": "critical",
          "score": -10,
          "feedback": "Перевод на карту не является сделкой: платформа его не видит и вернуть деньги не может. Бронь за задаток — сама по себе выдуманная услуга, её нет ни в одном честном сценарии покупки. Единственная защищённая форма предоплаты — оплата внутри платформы.",
          "next_step": "s3"
        },
        {
          "code": "b",
          "text": "Предложить задаток поменьше, чтобы рискнуть небольшой суммой",
          "outcome": "risky",
          "score": 0,
          "feedback": "Уменьшение суммы уменьшает потерю, но не отменяет её: перевод по-прежнему уходит мимо платформы и мимо защиты. Торг о размере предоплаты незаметно переводит разговор с вопроса «платить ли так вообще» на вопрос «сколько».",
          "next_step": "s3"
        },
        {
          "code": "c",
          "text": "Отказаться от перевода и предложить встречу или доставку платформы",
          "outcome": "safe",
          "score": 10,
          "feedback": "Отказ от предоплаты вне платформы закрывает основной способ потерять деньги в этой сделке. Встреча или доставка платформы одинаково безопасны: в обоих случаях вы платите за товар, который видите или получаете.",
          "next_step": "s3"
        }
      ]
    },
    {
      "code": "s3",
      "type": "dialog",
      "content": {
        "sender": "counterparty",
        "message": "Хорошо, тогда оформим через доставку — вот ссылка на оплату: avito-dostavka-pay.ru/order/88213. Оплатите там, и я передам телефон в пункт выдачи.",
        "attachment": {
          "kind": "link",
          "caption": "avito-dostavka-pay.ru/order/88213"
        }
      },
      "risk_signals": [
        "RISK_PHISHING_LINK",
        "RISK_URGENCY_PRESSURE"
      ],
      "options": [
        {
          "code": "a",
          "text": "Открыть ссылку и оплатить заказ",
          "outcome": "critical",
          "score": -10,
          "feedback": "Домен только похож на официальный: настоящие страницы оплаты живут внутри avito.ru, куда вы уже вошли. Форма по ссылке из переписки собирает данные карты, а не проводит оплату. Кнопка оплаты внутри объявления — единственный проверяемый путь.",
          "next_step": "end"
        },
        {
          "code": "b",
          "text": "Открыть ссылку, чтобы посмотреть, что за страница",
          "outcome": "risky",
          "score": 0,
          "feedback": "Денег вы не потеряли, но и проверкой это не является: поддельная страница выглядит убедительно именно для того, чтобы её открыли и доверились. Отличить подделку по внешнему виду нельзя — можно только по тому, откуда вы на неё попали.",
          "next_step": "end"
        },
        {
          "code": "c",
          "text": "Не открывать ссылку и оформить доставку кнопкой в объявлении",
          "outcome": "safe",
          "score": 10,
          "feedback": "Оформление из самого объявления исключает подмену адреса: вы остаётесь на платформе, где деньги резервируются и переводятся продавцу только после получения товара. Ссылка из переписки для этого не нужна никогда.",
          "next_step": "end"
        }
      ]
    },
    {
      "code": "end",
      "type": "terminal",
      "content": {
        "sender": "narrator",
        "message": "Разговор окончен. Разберём, где в нём были признаки риска и какие решения защищали вас, а какие — нет."
      },
      "risk_signals": [
        "RISK_TOO_GOOD_PRICE"
      ]
    }
  ]
}
